,postDate,headline,articleHTML,Unnamed: 0,date,ticker,daily_change
17,2017-11-07,The tallest building in California is almost done — here's the view from the top floor  Salesforce A.I. researchers came up with a faster way to translate text -- and it's based on tech from Google  Cramer: How the Salesforce-Google deal will help companies buck Amazon  Cramer: How the Salesforce-Google deal will help companies buck Amazon  CNBC tours the tallest office building on the west coast: the Salesforce Tower  How Salesforce-Google will help buck Amazon  ,"Dreamforce brings thousands of Salesforce employees to San Francisco for the company's annual meeting. This year, CNBC was able to escape the crowds for a bit by traveling to higher ground: the Salesforce Tower. At 1,070 feet tall, the tower dwarfs other buildings in the vicinity and is the tallest office building on the West Coast. It has 61 floors and elevators that can zip visitors to the top in 39 seconds, fast enough to make our ears pop. The Wilshire Grand in Los Angeles is technically taller, at 1,100 feet, but includes a 166-foot spire on top, while the Salesforce Tower has no spire.The floor is still under construction. It has floor-to-ceiling windows that offer 360-degree views of the city. We were able to spot the Bay Bridge, Golden Gate Bridge and Alcatraz during our visit.  Instead of executive offices, Salesforce says it will use the top floor as an events space, which will be open to employees as well as non-profits and NGOs. Salesforce is the building's anchor tenant and will occupy floors three to 30, 39 to 44, and the top two levels. The building is owned by Boston Properties and Hines.The Salesforce Tower is expected to open in early 2018. PlayingShare this video...Watch Next...Dreamforce brings thousands of Salesforce employees to San Francisco for the company's annual meeting. This year, CNBC was able to escape the crowds for a bit by traveling to higher ground: the Salesforce Tower. At 1,070 feet tall, the tower dwarfs other buildings in the vicinity and is the tallest office building on the West Coast. It has 61 floors and elevators that can zip visitors to the top in 39 seconds, fast enough to make our ears pop. The Wilshire Grand in Los Angeles is technically taller, at 1,100 feet, but includes a 166-foot spire on top, while the Salesforce Tower has no spire.The floor is still under construction. It has floor-to-ceiling windows that offer 360-degree views of the city. We were able to spot the Bay Bridge, Golden Gate Bridge and Alcatraz during our visit.  Instead of executive offices, Salesforce says it will use the top floor as an events space, which will be open to employees as well as non-profits and NGOs. Salesforce is the building's anchor tenant and will occupy floors three to 30, 39 to 44, and the top two levels. The building is owned by Boston Properties and Hines.The Salesforce Tower is expected to open in early 2018. PlayingShare this video...Watch Next...Dreamforce brings thousands of Salesforce employees to San Francisco for the company's annual meeting. This year, CNBC was able to escape the crowds for a bit by traveling to higher ground: the Salesforce Tower. At 1,070 feet tall, the tower dwarfs other buildings in the vicinity and is the tallest office building on the West Coast. It has 61 floors and elevators that can zip visitors to the top in 39 seconds, fast enough to make our ears pop. The Wilshire Grand in Los Angeles is technically taller, at 1,100 feet, but includes a 166-foot spire on top, while the Salesforce Tower has no spire.The floor is still under construction. It has floor-to-ceiling windows that offer 360-degree views of the city. We were able to spot the Bay Bridge, Golden Gate Bridge and Alcatraz during our visit.  Instead of executive offices, Salesforce says it will use the top floor as an events space, which will be open to employees as well as non-profits and NGOs. Salesforce is the building's anchor tenant and will occupy floors three to 30, 39 to 44, and the top two levels. The building is owned by Boston Properties and Hines.The Salesforce Tower is expected to open in early 2018. Dreamforce brings thousands of Salesforce employees to San Francisco for the company's annual meeting. This year, CNBC was able to escape the crowds for a bit by traveling to higher ground: the Salesforce Tower. At 1,070 feet tall, the tower dwarfs other buildings in the vicinity and is the tallest office building on the West Coast. It has 61 floors and elevators that can zip visitors to the top in 39 seconds, fast enough to make our ears pop. The Wilshire Grand in Los Angeles is technically taller, at 1,100 feet, but includes a 166-foot spire on top, while the Salesforce Tower has no spire.The floor is still under construction. It has floor-to-ceiling windows that offer 360-degree views of the city. We were able to spot the Bay Bridge, Golden Gate Bridge and Alcatraz during our visit.  Instead of executive offices, Salesforce says it will use the top floor as an events space, which will be open to employees as well as non-profits and NGOs. Salesforce is the building's anchor tenant and will occupy floors three to 30, 39 to 44, and the top two levels. The building is owned by Boston Properties and Hines.The Salesforce Tower is expected to open in early 2018. Dreamforce brings thousands of Salesforce employees to San Francisco for the company's annual meeting. This year, CNBC was able to escape the crowds for a bit by traveling to higher ground: the Salesforce Tower. At 1,070 feet tall, the tower dwarfs other buildings in the vicinity and is the tallest office building on the West Coast. It has 61 floors and elevators that can zip visitors to the top in 39 seconds, fast enough to make our ears pop. The Wilshire Grand in Los Angeles is technically taller, at 1,100 feet, but includes a 166-foot spire on top, while the Salesforce Tower has no spire.The floor is still under construction. It has floor-to-ceiling windows that offer 360-degree views of the city. We were able to spot the Bay Bridge, Golden Gate Bridge and Alcatraz during our visit.  Instead of executive offices, Salesforce says it will use the top floor as an events space, which will be open to employees as well as non-profits and NGOs. Salesforce is the building's anchor tenant and will occupy floors three to 30, 39 to 44, and the top two levels. The building is owned by Boston Properties and Hines.The Salesforce Tower is expected to open in early 2018. Dreamforce brings thousands of Salesforce employees to San Francisco for the company's annual meeting. This year, CNBC was able to escape the crowds for a bit by traveling to higher ground: the Salesforce Tower. At 1,070 feet tall, the tower dwarfs other buildings in the vicinity and is the tallest office building on the West Coast. It has 61 floors and elevators that can zip visitors to the top in 39 seconds, fast enough to make our ears pop. The Wilshire Grand in Los Angeles is technically taller, at 1,100 feet, but includes a 166-foot spire on top, while the Salesforce Tower has no spire.The floor is still under construction. It has floor-to-ceiling windows that offer 360-degree views of the city. We were able to spot the Bay Bridge, Golden Gate Bridge and Alcatraz during our visit.  Instead of executive offices, Salesforce says it will use the top floor as an events space, which will be open to employees as well as non-profits and NGOs. Salesforce is the building's anchor tenant and will occupy floors three to 30, 39 to 44, and the top two levels. The building is owned by Boston Properties and Hines.The Salesforce Tower is expected to open in early 2018. PlayingShare this video...Watch Next...PlayingShare this video...Watch Next...PlayingShare this video...Watch Next...Jordan Novet | CNBC
From left, Salesforce intern Jiatao Gu, chief scientist Richard Socher and research scientist James Bradbury.
 Salesforce on Tuesday revealed its latest progress around ways to translate text from one language into another without human input.
The translation system comes close to being the most accurate there is today by one measurement, and the researchers have ideas about how to improve it.
 ""We want to see it deployed in a lot of places,"" Salesforce chief scientist Richard Socher told CNBC in an interview at the company's Salesforce IQ office in Palo Alto, California.
In recent years, web companies like Facebook and Google have been the ones leading the way in terms of incorporating artificial intelligence into their products. Now Salesforce is among the companies drawing on AI to improve the software that people at big companies use. That could help Salesforce as it competes with the likes of IBM, Microsoft and Oracle.
Salesforce established its AI research lab following its 2016 acquisition of Socher's start-up, MetaMind. The group has doubled in size since then, Socher said. Like many other corporate research organizations, Salesforce Research regularly publishes results of its research and releases code online for free for others to explore. 
In this case, Salesforce circumvented technology called long short-term memory networks (LSTMs) that have become popular for machine translation. Instead, they chose to build on a system called Transformer, which Google unveiled earlier this year.
Translation has been revolutionized by the use of a trendy type of AI called deep learning, which involves training systems called artificial neural networks on lots of data and then getting them to make inferences about new data.
But the neural network-based systems can be slower to make inferences than more traditional architectures, as Socher and four of his collaborators -- Jiatao Gu, James Bradbury, Caiming Xiong and Victor O.K. Li -- point out in a new academic paper. Simply put, their model comes up with the best words for a translation in parallel, instead of in sequential order, which provides a speed boost. 
Bradbury explained some of the team's work with an analogy.
""You have a whole panel of professional translators, and they're all in separate cubicles somewhere,"" he said. ""You want to get a translated sentence, but you don't let them talk to each other. When you ask each of them to output one word, they're not going to make the right guesses about what each other is thinking. They're going to produce something that totally is gibberish. That's the problem that we ended up solving."" 
While Salesforce already offers technology that's based on work from its research lab, machine translation isn't in use in Sales Cloud, Service Cloud or any other product. That could change in the next few years, though.
""I think we'll see especially for technical documentation"" that it can come in handy, Socher said.
 var mps=mps||{}; mps._queue=mps._queue||{}; mps._queue.mpsinit=mps._queue.mpsinit||[]; 
 mps._queue.mpsinit.push(function() { 
 mps.insertComponent('#taboola_article_you_may_like', 'taboola-article-you-may-like') 
 });show chapters
 How Salesforce-Google will help buck Amazon   
 6:58  PM ET Tue,  7 Nov 2017 |  01:09 
 CNBC's Jim Cramer knows that playing offense and defense at the same time isn't easy, especially for a business.
 ""Yet whenever I speak to a truly competitive company, that's exactly what they're doing — playing both offense and defense using the power of digital, using the power of technology. They have no choice; if they don't embrace technology they'll be left behind,"" the ""Mad Money"" host said.
That's why Cramer saw Salesforce.com's partnership with Alphabet's Google, which was announced on Monday, as so important.
 The combination would pair Salesforce's customer relations management systems with Google's analytics and cloud platforms, giving clients more holistic ways to view customer data.
Cramer said the partnership would benefit retailers that compete with Amazon and would prefer not to pay for Amazon Web Services for their cloud-based needs.
""You don't pay your opponent when you're fighting them tooth and nail, not if you can avoid it,"" Cramer said. ""The problem has been that Amazon Web Services, with its amazing analytics that works seamlessly with Salesforce, really does give you an edge you couldn't find anywhere else, at least not until this Salesforce-Google team-up.""
The ""Mad Money"" host pointed to Monday's reports of Amazon launching its first two furniture brands, a sign that the e-commerce colossus could be moving into the furniture industry. 
Whether Amazon will make a wholehearted effort to enter the furniture space remains unclear, but furniture stocks from RH to Williams-Sonoma still suffered considerable losses on the news.
Cramer said that Amazon Web Services (which also partners with Salesforce) gives those retailers advantages in telling their stories and reaching new customers.
But if Amazon becomes a direct competitor, paying for its services becomes less attractive, particularly with Google offering a similarly effective analytics and marketing platform, he said.
""It's defense and it's offense. And judging by the declines of the stocks in the brick-and-mortar segment of this market ... it seems like not enough companies in that sector have a digital strategy that is strong on both sides of the field,"" Cramer said.
But companies, especially retailers, with a sound digital strategy now have an alternative to Amazon that could help them maintain their competitive streak against the e-commerce colossus.
""The bottom line is, no matter what the industry, if you own shares in a company that doesn't have not a digital strategy, but a winning digital strategy, your goose is cooked, as the other guys in the sector will set the oven at 500 degrees and burn your stock to a crisp,"" the ""Mad Money"" host said.
 WATCH: Cramer dives into what Salesforce-Google means for the market
 show chapters
 Cramer: How the Salesforce-Google deal will help companies buck Amazon   
 6:47  PM ET Tue,  7 Nov 2017 |  14:24 
 Questions for Cramer? Call Cramer: 1-800-743-CNBC Want to take a deep dive into Cramer's world? Hit him up! Mad Money Twitter -  Jim Cramer Twitter - Facebook - Instagram - Vine Questions, comments, suggestions for the ""Mad Money"" website? madcap@cnbc.com 
 var mps=mps||{}; mps._queue=mps._queue||{}; mps._queue.mpsinit=mps._queue.mpsinit||[]; 
 mps._queue.mpsinit.push(function() { 
 mps.insertComponent('#taboola_article_you_may_like', 'taboola-article-you-may-like') 
 });Jim Cramer explained why a Salesforce-Google combination would help companies play ""defense and offense"" against e-commerce giant Amazon.Jim Cramer explained why a Salesforce-Google combination would help companies play ""defense and offense"" against e-commerce giant Amazon.Jim Cramer explained why a Salesforce-Google combination would help companies play ""defense and offense"" against e-commerce giant Amazon.Jim Cramer explained why a Salesforce-Google combination would help companies play ""defense and offense"" against e-commerce giant Amazon.At 1,070 feet tall, the Salesforce Tower is now the tallest office building on the west coast. At 1,070 feet tall, the Salesforce Tower is now the tallest office building on the west coast. At 1,070 feet tall, the Salesforce Tower is now the tallest office building on the west coast. At 1,070 feet tall, the Salesforce Tower is now the tallest office building on the west coast. Jim Cramer explained why a Salesforce-Google combination would help companies play ""defense and offense"" against e-commerce giant Amazon.Jim Cramer explained why a Salesforce-Google combination would help companies play ""defense and offense"" against e-commerce giant Amazon.Jim Cramer explained why a Salesforce-Google combination would help companies play ""defense and offense"" against e-commerce giant Amazon.Jim Cramer explained why a Salesforce-Google combination would help companies play ""defense and offense"" against e-commerce giant Amazon.",64,2017-11-07,CRM,-0.002924833907246806
18,2017-11-08,Salesforce CEO dismisses Microsoft as a competitor  ,"Getty Images
Salesforce chairman and CEO Marc Benioff.
 At Dreamforce two years ago, Microsoft CEO Satya Nadella had a prime speaking spot and Salesforce's Marc Benioff touted the blossoming partnership between the two companies.
 Those days are gone. 
On Tuesday, Benioff used part of Salesforce's investor day meeting at Dreamforce to talk up Salesforce's expanded partnership with Google and its growing relationships with Amazon, Cisco, Dell and IBM. 
 But he didn't include Microsoft in that group, even after the companies made a big deal about their work together in 2014 and again in 2015.
 show chapters
 CRM's Benioff: How we're getting around the 'loyalty is dead' problem   
 6:57  PM ET Mon,  6 Nov 2017 |  01:16 
 It's a complicated relationship. Microsoft and Salesforce compete in areas like business intelligence and customer relationship management software. Beyond that, Microsoft outbid Salesforce for LinkedIn in 2016, and Microsoft previously tried to buy Salesforce.
This week, Salesforce made some moves of its own onto Microsoft's turf, integrating more deeply with both Google and Facebook.
At the investor meeting, Kirk Materne of Evercore asked Benioff if it would be possible for Microsoft and Salesforce to ""come back together on behalf of customers.""
Here's a transcript of what Benioff said in response:
 No, there's always one person in the room who's using a Surface laptop, so I get that. And it's you. Who else is using a Surface laptop? Raise your hand. OK, we have three people. And how many are using Macs? Raise your hand. How many iPads? OK. How many PCs? And then we've got the three Surface. You know, look. They're 1 percent of the CRM market. You know the numbers. I like having competitors. But what I just get blown away with is how they just can't keep, you know, that management team in place. They just keep leaving Microsoft. You know that. And I think they don't have confidence in that ability to execute in that business. So that has weighed to our favor, and customers feel that. You know because you go to these conferences just like I do. There is no conference like this that they do and that's the — in my opinion, the mark. That is — why is it that they don't have anything like this? That when they put on a conference like something — it's always the resellers who come together, and then -- where are these people? Now, that isn't to say they don't have, like, Build, where they get these really high-end developers using the IDE. You know what I mean? Is that the conference I've been to where I'm like, Oh, yeah, these are all the -- and they're all Windows -- they have a Windows fever. And they have Windows API fever at the conference. But I haven't seen that in any other part of their business, other than the Windows API. Maybe they'll get it in Azure -- I don't know. But I haven't seen that yet. Because the last time that I went to the conference, I didn't see that. I only see that fever around the Windows API. And the Surface laptop. 
Microsoft declined to comment.
 WATCH: Benioff says CRM & Google Analytics exciting for customers
 show chapters
 Salesforce CEO: Salesforce and Google Analytics together 'really exciting' for customers   
 4:59  PM ET Mon,  6 Nov 2017 |  03:35 
 var mps=mps||{}; mps._queue=mps._queue||{}; mps._queue.mpsinit=mps._queue.mpsinit||[]; 
 mps._queue.mpsinit.push(function() { 
 mps.insertComponent('#taboola_article_you_may_like', 'taboola-article-you-may-like') 
 });",63,2017-11-08,CRM,-0.02223918369303294
19,2017-11-15,Marc Benioff: Salesforce would not exist today without Steve Jobs  ,"In a recent interview with CNN's Poppy Harlow, Salesforce CEO Marc Benioff discussed his relationship with late Apple founder Steve Jobs and said that his company would not exist today without him. 
 Benioff was a 19-year-old college student in 1984 when Jobs gave him his first job as an assembly language programmer at Apple. The two kept in touch over the years, and Benioff says that when he was starting Salesforce, Jobs would invite him to his office to tutor and mentor him. 
""He was one of the greatest mentors I had,"" says Benioff.
 Tony Avelar | AFP | Getty Images
Apple chief executive Steve Jobs unveils a new mobile phone that can also be used as a digital music player and a camera, a long-anticipated device dubbed an 'iPhone.' at the Macworld Conference 09 January, 2007 in San Francisco, California.
 In the early 2000s, Benioff looked to the tech legend for advice when he was feeling stuck about the direction of his company. Jobs advised him to do three things. 
""One, Salesforce better be 10 times larger in 24 months or less, or else it's over,"" Benioff says Jobs told him. ""Two, you have to close a huge massive customer, like Avon...and three, you've got to build an application economy.""
 var mps=mps||{}; mps._queue=mps._queue||{}; mps._queue.gptloaded=mps._queue.gptloaded||[];
 mps._queue.gptloaded.push(function() {
 (mps && mps.insertAd && mps.insertAd('#dart_wrapper_responsiverectangle', 'responsiverectangle'));	
 });
 Benioff says he went home to brainstorm ways to put those ideas in to action. He thought of developing a huge marketplace for apps, but when Salesforce tested the product in focus groups, people responded that it was more an exchange than a store. 
 show chapters
 Why the co-founders of Siri first turned down a buyout offer from Steve Jobs   
 1:27  PM ET Fri,  9 June 2017 |  01:38 
 AppExchange launched in 2005. In 2008, Benioff received a call from Jobs asking him to come to his team's office for a big announcement. To his surprise, the announcement included Apple's launch of the App Store. 
""It was like a spiritual moment,"" said Benioff, ""because we had already launched our AppExchange three years before.""
After the event, Benioff congratulated Jobs on the launch and told him as a gift he was giving Apple the trademark and appstore.com URL he had purchased years ago thanks to his advice. 
""That was a great moment for me because I just remember that he had a huge impact on me personally and on Salesforce,"" Benioff added.  
Jobs impacted many business leaders beyond Benioff. Following Jobs' death in 2011, Bill Gates wrote a blog post about the Apple founder's influence not only on his own life, but on the world. 
""The world rarely sees someone who has had the profound impact Steve has had, the effects of which will be felt for many generations to come,"" wrote Gates. ""For those of us lucky enough to get to work with him, it's been an insanely great honor.""
 Like this story? Like CNBC Make It on Facebook.
Don't miss: 6 years ago today: Steve Jobs' untimely death taught Bill Gates this important lesson
 show chapters
 Tim Cook says Apple founder Steve Jobs had this unique gift   
 5:07  PM ET Tue, 12 Sept 2017 |  02:55 
 var mps=mps||{}; mps._queue=mps._queue||{}; mps._queue.mpsinit=mps._queue.mpsinit||[]; 
 mps._queue.mpsinit.push(function() { 
 mps.insertComponent('#taboola_article_you_may_like', 'taboola-article-you-may-like') 
 });",58,2017-11-15,CRM,0.007559329203063681
20,2017-11-17,What to watch for in upcoming Salesforce earnings  The two most important things to watch in Salesforce's upcoming earnings report  ,"show chapters
 The two most important things to watch in Salesforce's upcoming earnings report   
 4:21  PM ET Fri, 17 Nov 2017 |  01:23 
 Cloud computing company Salesforce.com is set to report quarterly earnings Tuesday, and one strategist is watching closely, as it's one of the few remaining large tech names to report this earnings season. The technology sector has posted a strong round of earnings, said Mark Tepper, CEO of Strategic Wealth Partners, and Salesforce.com shares have outperformed technology over the course of the year. He will be watching for whether the company can keep up, given the stock's hefty valuation of 66 times forward earnings, according to FactSet data. Here's what he will be looking for to confirm that. • The trend in the company's international growth will be most interesting to Tepper, he explained Friday on CNBC's ""Trading Nation."" He said there is more opportunity to be had internationally. • ""We've seen 74 percent of sales coming from the Americas over the course of the last several years. We want to see that trend down, and we want to see more revenues coming from overseas,"" he said. • He is also looking at its bottom-line results to see the extent to which expenses associated with overseas expansion are reflected in its net profits. Tepper added in an email to CNBC that this could prove to be a short-term headwind on profitability. • Salesforce.com's top-line results are likely to benefit from its varied cloud offerings and spending on digital marketing, he added. Analysts are expecting earnings of 37 cents per share, according to FactSet estimates. Salesforce.com shares have advanced 57 percent year to date.  Bottom line: Trends in international growth will be important to watch for in the company's earnings report next week.
 Vote
Vote to see results
 Total Votes: 
Not a Scientific Survey. Results may not total 100% due to rounding.
 var mps=mps||{}; mps._queue=mps._queue||{}; mps._queue.mpsinit=mps._queue.mpsinit||[]; 
 mps._queue.mpsinit.push(function() { 
 mps.insertComponent('#taboola_article_you_may_like', 'taboola-article-you-may-like') 
 });Why Mark Tepper of Strategic Wealth Partners is watching Salesforce ahead of earnings next week.Why Mark Tepper of Strategic Wealth Partners is watching Salesforce ahead of earnings next week.Why Mark Tepper of Strategic Wealth Partners is watching Salesforce ahead of earnings next week.Why Mark Tepper of Strategic Wealth Partners is watching Salesforce ahead of earnings next week.",56,2017-11-17,CRM,-0.005125587848812205
