,postDate,headline,articleHTML,Unnamed: 0,date,ticker,daily_change
9,2017-08-22,"Salesforce stock drops despite earnings beat  Salesforce's Marc Benioff details cloud giant's push into A.I., dishes on secret client  Salesforce's Marc Benioff details cloud giant's push into AI, dishes on secret client  Salesforce's partnership with Amazon is helping solve one of its biggest problems  Salesforce beats on top and bottom line  Salesforce is strategically favorable: Pivotal Research's Brian Wieser  CRM's Benioff on push into AI  ","show chapters
 Salesforce is strategically favorable: Pivotal Research's Brian Wieser   
 7:29  PM ET Tue, 22 Aug 2017 |  02:03 
 Salesforce reported its second quarter earnings on Tuesday after the bell, and the numbers came in above estimates.
 Here are the most important numbers:
 Adjusted EPS: 33 cents vs. 32 cents per share expected by a Thomson Reuters consensus estimate Revenue: $2.56 billion vs. $2.51 billion expected by a Thomson Reuters consensus estimate 
 Despite the overall beat, Salesforce's stock dropped almost 3 percent before trading roughly flat in after hours. Salesforce's stock enjoyed a surprise 6 percent jump over the past couple weeks in the run up to Tuesday's earnings, and is up over 30 percent this year.
After going on a record buying spree in 2016, Salesforce has slowed its pace of acquisition this year, with only one deal announced so far. Instead, the business software maker has focused on generating growth from its prior deals, especially in the artificial intelligence market.
Salesforce's revenue saw a 26 percent jump from a year-ago period, while its deferred revenue, an important metric that reflects its future growth, grew 26 percent year-over-year as well, to $4.82 billion. Unbilled deferred revenue, the portion of contracts that have not been billed yet and off the balance sheet,  also grew 30 percent from last year to $10.4 billion.
 ""We have $15B in on and off the balance sheet deferred revenue. That is the predictor of our future revenue growth. That's revenue that we have signed but not yet recognized. Incredible numbers,"" Salesforce CEO Marc Benioff said in an interview with CNBC's Jim Cramer.
The company's third quarter revenue is expected to be in the range of $2.64 billion to $2.65 billion, which exceeds street estimates of $2.61 billion. 
Salesforce raised its full year guidance by $100 million to the range of $10.35 billion to $10.40 billion. That would make it the first year for Salesforce to cross the $10 billion annual revenue mark.
""We did this faster than any other enterprise software company in history,"" Benioff said in a statement.
Still, competition is increasing from companies like Microsoft, Oracle, and ServiceNow. Salesforce's Service Cloud, its second-largest business, has struggled to reach its internal goals of late, leading to four leadership changes in four years. 
For more on Salesforce, watch CEO Marc Benioff's interview on ""Mad Money"" tonight at 6 p.m. ET.
 show chapters
 Salesforce beats on top and bottom line   
 5:00  PM ET Tue, 22 Aug 2017 |  00:50 
 var mps=mps||{}; mps._queue=mps._queue||{}; mps._queue.mpsinit=mps._queue.mpsinit||[]; 
 mps._queue.mpsinit.push(function() { 
 mps.insertComponent('#taboola_article_you_may_like', 'taboola-article-you-may-like') 
 });show chapters
 CRM's Benioff on push into AI   
 6:50  PM ET Tue, 22 Aug 2017 |  00:55 
 Shares of Salesforce may have ticked down after the company's earnings beat, but CEO Marc Benioff was entirely forward-looking when he discussed his cloud giant's prospects with CNBC.
 ""We're really seeing this incredible new capability that's driving so much growth in enterprise software, artificial intelligence, and Salesforce is the first to deliver artificial intelligence in all of our products that are helping our customers do machine learning and machine intelligence and deep learning using Einstein,"" Benioff told ""Mad Money"" host Jim Cramer on Tuesday.
Einstein, Salesforce's A.I. platform, was rolled out in 2016 as the company turned its focus to cutting-edge developments in the world of software, Benioff said.
 ""I think everybody understands how important the cloud is. It's the single most transformative technology in enterprise software today. I think everybody understands mobility because everybody's got a cellphone and lots of apps and seen how they've moved off of PCs and onto mobility,"" Benioff said. ""Einstein is Salesforce's AI platform that is really the next generation of Salesforce's products and it's in the hands of all of our customers right now and making a huge difference. It makes them have the ability to make much smarter decisions about their business each and every day.""
On top of its earnings beat, Salesforce hit an annual revenue run-rate, or future revenue forecast, of over $10 billion faster than any other enterprise software company, ever.
Benioff touted the software giant's 24 percent revenue growth forecast, attributing it in part to the rapid growth in the customer relationship management market.
""The forecasts are that the CRM market is going to $1 trillion,"" Benioff told Cramer. ""The CRM market has gone from being an also-ran market in enterprise software to the largest and most important market in enterprise software. It used to be operating systems, it used to be databases, it used to be other things in enterprise software. Now it's all about CRM and we are No. 1 in the fastest growing segment in enterprise software. That is growing our revenue so dramatically.""
Salesforce's earnings were also driven by an array of new clients including luxury fashion brand Louis Vuitton and the United States Department of Veterans Affairs.
Benioff said Salesforce helped Louis Vuitton produce a tech-enabled watch tied to an app connected with Salesforce.
But Salesforce's biggest new client, one of the largest auto manufacturers in the world, asked the cloud company not to publicly name them.
""[They] signed a wall-to-wall agreement with us in sales, in service, in marketing, in commerce, in all these areas,"" Benioff said. ""Very exciting.""
The Department of Veterans Affairs, on the other hand, commissioned Salesforce to create an assortment of high-quality systems to help veterans connect to their customers.
When Cramer asked Benioff how he felt working for President Donald Trump's administration in light of recent controversy, the Salesforce chief offered a measured response.
""I've worked with three administrations, and I have a set of core values,"" Benioff said. ""One of them [is] equality. Another one is love. And the things that are important to me don't change. Administrations change.""
The CEO said that when Trump asked him for advice, Benioff told him to focus on apprenticeships given the rise of artificial intelligence and, following that, job displacement.
""We need to make sure we do more job retraining, and that's why we're working to have a 5 million apprenticeship dream,"" Benioff told Cramer. ""But for the CEOs who call me and say, 'What should I do? Should I resign? Should I stay? Should I go?' I don't really know what to tell them, because I didn't join any of the councils because I really learned a long time ago the best thing I can do is just give my best advice. And the best way that I can give my best advice is not to be encumbered with any job with any administration.""
 Watch Marc Benioff's full interview here:
 show chapters
 Salesforce's Marc Benioff details cloud giant's push into AI, dishes on secret client   
 6:48  PM ET Tue, 22 Aug 2017 |  09:59 
 Questions for Cramer? Call Cramer: 1-800-743-CNBC Want to take a deep dive into Cramer's world? Hit him up! Mad Money Twitter -  Jim Cramer Twitter - Facebook - Instagram - Vine Questions, comments, suggestions for the ""Mad Money"" website? madcap@cnbc.com 
 var mps=mps||{}; mps._queue=mps._queue||{}; mps._queue.mpsinit=mps._queue.mpsinit||[]; 
 mps._queue.mpsinit.push(function() { 
 mps.insertComponent('#taboola_article_you_may_like', 'taboola-article-you-may-like') 
 });Jim Cramer spoke with Salesforce Chairman and CEO Marc Benioff after earnings to hear about the cloud company's progress.Jim Cramer spoke with Salesforce Chairman and CEO Marc Benioff after earnings to hear about the cloud company's progress.Jim Cramer spoke with Salesforce Chairman and CEO Marc Benioff after earnings to hear about the cloud company's progress.Jim Cramer spoke with Salesforce Chairman and CEO Marc Benioff after earnings to hear about the cloud company's progress.Frank Muldoon | CNBC
Marc Benioff
 Salesforce has struck a number of partnership deals with Amazon Web Services over the past year, suddenly becoming a close ally of Amazon's cloud arm.
 That relationship is starting to bear fruit, Salesforce says, as it's helping solve one glaring weakness in the cloud software maker's business: overseas sales.
Salesforce said during its earnings call on Tuesday that its partnership with AWS has helped open up new opportunities in countries like Canada and Australia. Salesforce started running its software in AWS data centers in Canada last month, and is planning to do so in Australia later this year. 
 The offering is aimed at targeting companies that may feel uncomfortable storing their data in data centers outside their region. For example, a lot of government agencies and financial services firms are still sensitive about using data centers that are not located in their own country.
Salesforce has previously run its software in data centers it owns. But last year, it announced it would use AWS to run some of its software after committing to spend $400 million over four years on Amazon's cloud platform, which has a wider footprint in more geographic regions.
Salesforce said it signed up companies like Nomura, Queensland Urban Utilities, and Australia Post last quarter.
""With AWS, that relationship is strong and that just gives us a lot of flexibility as we continue to focus and expand internationally,"" Salesforce president and COO Keith Block said during the call.
Growing international sales is important for Salesforce. The company still gets over 70% of its sales from the North American region — with the US market accounting for over 90% of the share — and the growth rates of overseas sales have been stagnant, hovering at around 30% annually.
In the 2nd quarter, Europe accounted for 18 percent of total revenue, while the Asia Pacific market accounted for 10 percent of the total. That's a small share compared to Microsoft or Oracle who drive almost half of their revenue from overseas markets, according to FactSet.
Block said Salesforce will continue to make ""significant investments"" in overseas markets as it presents a lot of new upside. In fact, more than 40 percent of all new hires have come from outside of the US, he said.
""Our international growth continues to represent a huge opportunity for Salesforce,"" Block said.
 show chapters
 Salesforce beats on top and bottom line   
 5:00  PM ET Tue, 22 Aug 2017 |  00:50 
 var mps=mps||{}; mps._queue=mps._queue||{}; mps._queue.mpsinit=mps._queue.mpsinit||[]; 
 mps._queue.mpsinit.push(function() { 
 mps.insertComponent('#taboola_article_you_may_like', 'taboola-article-you-may-like') 
 });CNBC's Josh Lipton reports on the quarterly earnings for Salesforce.CNBC's Josh Lipton reports on the quarterly earnings for Salesforce.CNBC's Josh Lipton reports on the quarterly earnings for Salesforce.CNBC's Josh Lipton reports on the quarterly earnings for Salesforce.Abhey Lamba, Mizuho, and Brian Wieser, Pivotal Research, discuss what they expect from Salesforce ahead of its earnings report.Abhey Lamba, Mizuho, and Brian Wieser, Pivotal Research, discuss what they expect from Salesforce ahead of its earnings report.Abhey Lamba, Mizuho, and Brian Wieser, Pivotal Research, discuss what they expect from Salesforce ahead of its earnings report.Abhey Lamba, Mizuho, and Brian Wieser, Pivotal Research, discuss what they expect from Salesforce ahead of its earnings report.Jim Cramer spoke with Salesforce Chairman and CEO Marc Benioff after earnings to hear about the cloud company's progress.Jim Cramer spoke with Salesforce Chairman and CEO Marc Benioff after earnings to hear about the cloud company's progress.Jim Cramer spoke with Salesforce Chairman and CEO Marc Benioff after earnings to hear about the cloud company's progress.Jim Cramer spoke with Salesforce Chairman and CEO Marc Benioff after earnings to hear about the cloud company's progress.",118,2017-08-22,CRM,-0.012885241346337782
10,2017-08-23,Another 'break out quarter' for Salesforce: Jim Cramer  ,"The ""Squawk on the Street"" news team talks about Salesforce's quarterly results and its cloud computing play.The ""Squawk on the Street"" news team talks about Salesforce's quarterly results and its cloud computing play.The ""Squawk on the Street"" news team talks about Salesforce's quarterly results and its cloud computing play.The ""Squawk on the Street"" news team talks about Salesforce's quarterly results and its cloud computing play.",117,2017-08-23,CRM,-0.001290184030165976
11,2017-08-31,"CEO of privately-held Informatica details 'agnostic' partnerships with Amazon, Salesforce  ",Jim Cramer sat down with Informatica CEO Anil Chakravarthy to hear more about the data management company's lines of business.Jim Cramer sat down with Informatica CEO Anil Chakravarthy to hear more about the data management company's lines of business.Jim Cramer sat down with Informatica CEO Anil Chakravarthy to hear more about the data management company's lines of business.Jim Cramer sat down with Informatica CEO Anil Chakravarthy to hear more about the data management company's lines of business.,111,2017-08-31,CRM,-0.0066194095126754435
12,2017-09-19,"""Fast Money"" final trades: MLCO, CAR and more  ","The “Fast Money” traders share their final trades for the day, including Melco Crown Entertainment, Avis Budget Group, Micro Technology and Salesforce.The “Fast Money” traders share their final trades for the day, including Melco Crown Entertainment, Avis Budget Group, Micro Technology and Salesforce.The “Fast Money” traders share their final trades for the day, including Melco Crown Entertainment, Avis Budget Group, Micro Technology and Salesforce.The “Fast Money” traders share their final trades for the day, including Melco Crown Entertainment, Avis Budget Group, Micro Technology and Salesforce.",99,2017-09-19,CRM,0.004081851917934928
13,2017-10-26,Cramer's lightning round: Software play Splunk doesn't live up to Salesforce  Cramer's lightning round: Software play Splunk doesn't live up to Salesforce  ,"It's that time again! Jim Cramer rang the lightning round bell, which means he gave his take on callers' favorite stocks at rapid speed:
 Splunk: ""I like Splunk. I like Splunk a lot, but I've got to tell you, I like Salesforce more.""
Albemarle Corporation: ""Oh, man. You cut me to the quick. I like FMC [Corp.] right here a little bit more than Albemarle. Albemarle's stalled right now.""
 Zagg Inc.: ""Like Zagg. Buy, buy, buy, buy, buy!""
Brunswick Corporation: ""I would wait until Brunswick settles.""
 Watch the full (wacky) lightning round here:
 show chapters
 Cramer's lightning round: Software play Splunk doesn't live up to Salesforce   
 7:00  PM ET Thu, 26 Oct 2017 |  04:28 
 Questions for Cramer? Call Cramer: 1-800-743-CNBC Want to take a deep dive into Cramer's world? Hit him up! Mad Money Twitter -  Jim Cramer Twitter - Facebook - Instagram - Vine Questions, comments, suggestions for the ""Mad Money"" website? madcap@cnbc.com 
 var mps=mps||{}; mps._queue=mps._queue||{}; mps._queue.mpsinit=mps._queue.mpsinit||[]; 
 mps._queue.mpsinit.push(function() { 
 mps.insertComponent('#taboola_article_you_may_like', 'taboola-article-you-may-like') 
 });Jim Cramer zipped through his take on callers' favorite stocks, including a smaller Salesforce competitor.Jim Cramer zipped through his take on callers' favorite stocks, including a smaller Salesforce competitor.Jim Cramer zipped through his take on callers' favorite stocks, including a smaller Salesforce competitor.Jim Cramer zipped through his take on callers' favorite stocks, including a smaller Salesforce competitor.",72,2017-10-26,CRM,-0.004608303086194219
14,2017-10-31,"Guggenheim: 22% upside for Salesforce  ""Fast Money"" final trades: C, EEM and more  ","The ""Halftime Report"" traders debate the call of the day - Guggenheim initiating coverage on Salesforce.The ""Halftime Report"" traders debate the call of the day - Guggenheim initiating coverage on Salesforce.The ""Halftime Report"" traders debate the call of the day - Guggenheim initiating coverage on Salesforce.The ""Halftime Report"" traders debate the call of the day - Guggenheim initiating coverage on Salesforce.The “Fast Money” traders share their final trades for the day including Citi, MSCI Emerging Markets ETF, General Electric and Salesforce.The “Fast Money” traders share their final trades for the day including Citi, MSCI Emerging Markets ETF, General Electric and Salesforce.The “Fast Money” traders share their final trades for the day including Citi, MSCI Emerging Markets ETF, General Electric and Salesforce.The “Fast Money” traders share their final trades for the day including Citi, MSCI Emerging Markets ETF, General Electric and Salesforce.",69,2017-10-31,CRM,-0.0161548036524292
15,2017-11-01,Salesforce CEO Marc Benioff reminds employees of workplace drinking ban: 'Alcohol is a drug'  ,"David Paul Morris | Bloomberg | Getty Images
Marc Benioff, CEO of Salesforce.com speaks during the DreamForce Conference in San Francisco, Oct. 5, 2016.
 Salesforce CEO Marc Benioff left a strong message for his 25,000 employees last month after seeing alcoholic drinks and kegs sitting in the office: take them out.
 ""I want to remind everyone that we have a no alcohol policy at Salesforce,"" Benioff wrote in an internal blog post seen by CNBC. ""Alcohol is a drug and having alcohol on a Salesforce premise is simply unfair to the Ohana who either do not want it or are intolerant of it.""
Benioff, who often calls his employees ""Ohana,"" the Hawaiian word for family, isn't the only public company CEO to enforce a no-drinking policy at work. But he's certainly one of the first tech CEOs to put a hard ban on workplace drinking — a trendy office perk in Silicon Valley that has almost become the norm among tech companies as they try to attract talent with a more laid-back office culture.
 Office booze has gained popularity, particularly among tech startups run by young CEOs, as it helps avoid an old, stodgy company image and is believed to encourage an environment where employees enjoy their time together.
Companies such as Twitter and Glassdoor have multiple kegs of beer available free of charge to employees at any time. Yelp and GitHub have free booze but only allow access after work or in certain parts of the office. Facebook and Google don't have an official ban on alcohol, but employees are expected to use common sense when it comes to drinking.
But a growing number of tech companies are starting to kick alcohol out of the office entirely.
Start-up Zenefits banned office drinking last year as part of its effort to clean up its party-like work culture. Uber is considering instituting a similar ban during ""core working hours"" and reducing the budget for drinks during after-hour events, based on recommendations by an outside law firm. Jet.com has gotten stricter about enforcing a no-booze rule after getting acquired by Wal-Mart, which doesn't allow office drinking, according to The Wall Street Journal.
Salesforce officially announced an alcohol ban at an all-hands meeting held more than a year ago, another person said. It's unclear what inspired the change, but Benioff shared his thoughts about it on Twitter last year, when he wrote, ""No room for alcohol or drugs in a start up or tech culture. The CEO has to set the tone from the top and enforce.""
 There are plenty of reasons for companies to think twice about allowing alcohol in the office. Free booze is an added expense for the company. Workplace drinking increases the likelihood of bad behavior, such as sexual harassment, which has become a growing problem in the tech industry. And, as Benioff points out, those who can't tolerate alcohol likely don't want to be exposed to it.
But the biggest risk lies in the potential liability issues that follow, according to Peter Cappelli, a management professor at the Wharton School. If an employee gets into trouble, such as a car accident, after drinking alcohol provided by the employer, the company could be legally liable, he said.
""Employers are rightly concerned about legal liability for actions that their employees take either at work or after hours when they have been drinking alcohol provided by the employer,"" Cappelli said. ""If I'm injured by a drunk employee, I'm likely to sue their employer because the employer has more money.""
Still, not everyone's happy with Salesforce's decision to ban office drinking. Some Salesforce employees aired their frustration on Blind, an anonymous chat app that requires users to have a working company email in order to post about their employer. 
In a message in a public forum seen by CNBC, one person wrote that office drinking should be a choice and shouldn't be considered an inclusivity issue because no one's forcing others to drink.
""It's not as if drinking was mandatory by any means,"" the person wrote. ""It seems like excluding something optional under the guise of inclusivity doesn't make any sense logically.""
 WATCH: Benioff on CRM's push into AI
 show chapters
 CRM's Benioff on push into AI   
 6:50  PM ET Tue, 22 Aug 2017 |  00:55 
 var mps=mps||{}; mps._queue=mps._queue||{}; mps._queue.mpsinit=mps._queue.mpsinit||[]; 
 mps._queue.mpsinit.push(function() { 
 mps.insertComponent('#taboola_article_you_may_like', 'taboola-article-you-may-like') 
 });",68,2017-11-01,CRM,0.003818106356481521
