,postDate,headline,articleHTML,Unnamed: 0,date,ticker,daily_change
4,2017-06-27,"Uber scandal will not be the last crisis of equality for tech industry, says Salesforce CEO Marc Benioff  Uber will not be the last crisis of equality in the tech industry: Salesforce CEO  Some FAANGS are still undervalued: Salesforce CEO  Some FANG stocks are still undervalued, says Salesforce CEO Marc Benioff  A major Salesforce shareholder says the stock could double in 3 years  Salesforce CEO on the record  Salesforce stock has potential to double: Josh Spencer  Top tech manager: buy this stock  ","show chapters
 Uber will not be the last crisis of equality in the tech industry: Salesforce CEO   
 5:47  AM ET Tue, 27 June 2017 |  02:07 
 Uber's tumultuous six months of scandal is likely to mark the first of many equality crises in the tech industry, according to Salesforce Chief Executive Marc Benioff.
 Speaking on the sidelines of the World Economic Forum in Dalian, China, Benioff warned that tech giants would need to take their capabilities to another level in order to avoid the chaos which rocked Uber.
Travis Kalanick, the former chief executive at the transportation colossus, resigned from his position last week in the face of pressure from Uber's five largest investors.
 ""I think because equality is more dominant in our industry than ever before, you saw that when (Kalanick's) employees started to write a very strong narrative about how that was not valued inside that leadership team… It became a crisis of equality,"" Benioff told CNBC on Tuesday.
""That will not be the last crisis of equality that you will see in the tech industry. I think it's just one at the beginning of several,"" he added.
 'Our industry wants to see more equality'
 Frank Muldoon | CNBC
Marc Benioff
 Kalanick stepped down as Uber CEO on June 20. The New York Times reported several board members demanded Kalanick leave the company after a string of sexual harassment and discrimination allegations against the company's leadership surfaced.
In February, Susan Fowler – a former Uber employee – published an account alleging sexual harassment and gender bias during her time at the company.
The account, titled ""Reflecting on one very, very strange year at Uber"" claimed there were multiple instances where managers and human resources representatives acted poorly.
""When Ms Fowler started to talk about what was going on at Uber, that just amplified I think that many people in our industry and I think in other industries want to see more equality,"" Benioff concluded.
 var mps=mps||{}; mps._queue=mps._queue||{}; mps._queue.mpsinit=mps._queue.mpsinit||[]; 
 mps._queue.mpsinit.push(function() { 
 mps.insertComponent('#taboola_article_you_may_like', 'taboola-article-you-may-like') 
 });Salesforce CEO Marc Benioff discusses Travis Kalanick's recent resignation as Uber CEO and equality in the tech industry more broadly.Salesforce CEO Marc Benioff discusses Travis Kalanick's recent resignation as Uber CEO and equality in the tech industry more broadly.Salesforce CEO Marc Benioff discusses Travis Kalanick's recent resignation as Uber CEO and equality in the tech industry more broadly.Salesforce CEO Marc Benioff discusses Travis Kalanick's recent resignation as Uber CEO and equality in the tech industry more broadly.Salesforce CEO Marc Benioff speaks about his view on the top technology stocks, as well as how artificial intelligence is disrupting his industry.Salesforce CEO Marc Benioff speaks about his view on the top technology stocks, as well as how artificial intelligence is disrupting his industry.Salesforce CEO Marc Benioff speaks about his view on the top technology stocks, as well as how artificial intelligence is disrupting his industry.Salesforce CEO Marc Benioff speaks about his view on the top technology stocks, as well as how artificial intelligence is disrupting his industry.show chapters
 Some FAANGS are still undervalued: Salesforce CEO   
 5:28  AM ET Tue, 27 June 2017 |  02:50 
 Salesforce Chief Executive Marc Benioff told CNBC on Tuesday that despite an unprecedented rally among high-growth technology giants, some FANG stocks still remain undervalued.
 The so-called FANG technology stocks refer to Facebook, Amazon, Netflix and Google (through parent company Alphabet). Some investors also recognize Apple as an additional 'A' to the FANG acronym.""I think some of those FANGs are still undervalued, I would agree with Jim Cramer,"" Benioff said on the sidelines of the World Economic Forum in Dalian, China.
Cramer, CNBC's ""Mad Money"" host, suggested last week that FANG's seemingly relentless run higher would most likely be led by Amazon during this ""very broad growth rally"".
 ""You look at Amazon Web Services (AWS) business going past $20 billion this year and I think it is on a trajectory to go to $100 billion,"" Benioff said.
The Salesforce CEO said his company enjoyed a close working relationship with Amazon and predicted the Seattle-based firm would have a ""tremendous upside"" with Chief Executive Jeff Bezos at the helm.
 FANG rally could be a 'bearish signal'
 Adam Jeffery | CNBC 
FANG (Facebook, Amazon, Netflix and Google) apps on a smartphone.
 Meanwhile, on Saturday, the man often hailed as the original ""Dr. Doom"" pointed to the meteoric rise of FANG stocks as a glaringly bearish signal for the U.S. stock market.
Marc Faber, the editor of ""The Gloom, Boom & Doom Report"" and a perennial bear, predicted the stocks could soon be sent plummeting by 40 percent or more.
""You know we have a lot of volatility, and when things will start to go down, they'll go down a lot,"" he said.Faber is deeply concerned that wealth has flowed to big corporations and affluent people. He believes the imbalance could eventually disrupt the markets as we know it.
—CNBC's Stephanie Landsman contributed to this report.
 var mps=mps||{}; mps._queue=mps._queue||{}; mps._queue.mpsinit=mps._queue.mpsinit||[]; 
 mps._queue.mpsinit.push(function() { 
 mps.insertComponent('#taboola_article_you_may_like', 'taboola-article-you-may-like') 
 });show chapters
 Salesforce stock has potential to double: Josh Spencer   
 12:44  PM ET Tue, 27 June 2017 |  04:06 
 Salesforce's stock has a lot of runway ahead of it and could easily double within the next three years, tech fund manager Josh Spencer told CNBC on Tuesday.
 ""This is the biggest position in my fund. It's close to 15 percent of the fund right now, and I think it's got a lot of upside over the next several years,"" the manager of the T. Rowe Price Global Technology Fund said on ""Halftime Report.""
The company has ""fantastic top-line growth, a great management team, really well-positioned across cloud software with a number of different clouds that they offer and they've just put up the numbers for so long,"" he added.
 Spencer spoke a day after SunTrust Robinson Humphrey initiated coverage of the company with a buy rating and a price target of $110. SunTrust said investors should buy Salesforce stock in part because it believes the company ""can sustain 20-percent-plus top-line growth.""
Terry Tillman, an equity research analyst at SunTrust, said in a note to clients that Salesforce's service, market and commerce clouds could fuel that overall growth.
Salesforce stock was up about modestly midafternoon Tuesday, and has risen more than 26 percent over the past six months, according to FactSet.
Regarding other tech stocks, Spencer said he has hopped out of FANG stocks Facebook and Apple, saying most FANG stocks are fully valued, but not overvalued. 
FANG refers to Facebook, Amazon, Netflix and Google's Alphabet. Some investors also recognize Apple as an additional ""A"" in the FANG acronym.
""I probably have the highest-weight software sector that I've had since I've managed the fund ... and I have less in the internet sector,"" he said.
 Disclaimer
 var mps=mps||{}; mps._queue=mps._queue||{}; mps._queue.mpsinit=mps._queue.mpsinit||[]; 
 mps._queue.mpsinit.push(function() { 
 mps.insertComponent('#taboola_article_you_may_like', 'taboola-article-you-may-like') 
 });Mark Benioff is talking FANG stocks and Uber in some exclusive comments to CNBC.Mark Benioff is talking FANG stocks and Uber in some exclusive comments to CNBC.Mark Benioff is talking FANG stocks and Uber in some exclusive comments to CNBC.Mark Benioff is talking FANG stocks and Uber in some exclusive comments to CNBC.Josh Spencer, portfolio manager at T. Rowe Price Global Technology Fund, discusses why he's getting out of the FANG stocks and why he's investing in other tech names.Josh Spencer, portfolio manager at T. Rowe Price Global Technology Fund, discusses why he's getting out of the FANG stocks and why he's investing in other tech names.Josh Spencer, portfolio manager at T. Rowe Price Global Technology Fund, discusses why he's getting out of the FANG stocks and why he's investing in other tech names.Josh Spencer, portfolio manager at T. Rowe Price Global Technology Fund, discusses why he's getting out of the FANG stocks and why he's investing in other tech names.The “Fast Money Halftime Report” traders discuss Salesforce as their call of the day. The “Fast Money Halftime Report” traders discuss Salesforce as their call of the day. The “Fast Money Halftime Report” traders discuss Salesforce as their call of the day. The “Fast Money Halftime Report” traders discuss Salesforce as their call of the day. ",157,2017-06-27,CRM,0.0048922106789329066
5,2017-06-28,"Salesforce's embrace of AI was sparked by an edict from Marc Benioff, co-founder says  ","Salesforce cofounder Parker Harris, right, with CEO Marc Benioff at Salesforce's 2015 Dreamforce conference.
 Artificial intelligence is reshaping Salesforce in the same way that mobile and social did in years past.
 The company thrived in the transition to mobile computing with custom apps for smartphones and succeeded in social with messaging service Chatter as well as tools for tracking internet ads. Now, Salesforce is embracing AI to automate sales leads and make customer service smarter.
On Wednesday,  Salesforce introduced new AI services that third-party developers can weave into their applications.
 How did this internal trend start?
Marc Benioff, Salesforce's CEO, issued an edict of sorts a couple years ago telling his staff that ""everything needs to be powered by AI,"" said Parker Harris, the company's co-founder and product strategy chief, in an interview with CNBC.
""He said, 'You know what -- we need to have AI in all of our clouds,'"" Harris said.
Historically, Benioff has played the role of idea guy at the cloud software company, while the work of implementing ideas has fallen to Harris.
With AI, Salesforce engineers were doing some testing, but the efforts were propelled forward through a flurry of deals. The company acquired BeyondCore, Implisit Insights, MinHash, PredictionIO and most importantly MetaMind. Recent acquisitions Demandware and Krux also had some AI projects in the works, Harris said.
 show chapters
 Uber will not be the last crisis of equality in the tech industry: Salesforce CEO   
 5:47  AM ET Tue, 27 June 2017 |  02:07 
 Salesforce has to keep pace with other big technology firms that are also investing heavily in AI and is paying up for acquisitions and individual hires. 
Harris, meanwhile, has been busy injecting AI into Salesforce's services in accord with Benioff's directive, which came in early 2015 by his recollection. For example, the company is applying AI to its core business of tracking customer relationships and other areas like customer service interactions and marketing.
""It wouldn't have worked if we had said, 'Let's build the brain for Salesforce and then start to apply it to each of the areas,'"" Harris said. 
At the same time, Salesforce also wants to provide core services that other applications can use. The new tools for app developers allow third parties to pick up on sentiment and intent in text and recognize objects in images through Salesforce's Einstein portfolio.
Salesforce is also getting some help from another big player in AI. In March the company announced a partnership with IBM to have Watson contribute relevant information to Salesforce's clouds.
""It's pretty cool that we're able to leverage all that AI and add it to our AI,"" Harris said.
 var mps=mps||{}; mps._queue=mps._queue||{}; mps._queue.mpsinit=mps._queue.mpsinit||[]; 
 mps._queue.mpsinit.push(function() { 
 mps.insertComponent('#taboola_article_you_may_like', 'taboola-article-you-may-like') 
 });",156,2017-06-28,CRM,-0.004665195921998903
6,2017-07-11,Cramer's charts show 3 cloud stocks shooting for the stars  3 cloud stocks shooting for the stars  Cramer's charts show 3 cloud stocks shooting for the stars  ,"As investors shy away from the technology sector for fear that parts of it are overvalued, Jim Cramer wanted to make the case for three cloud stocks that he believes have more room to run.
 ""In the last few weeks, stocks of cloud kingpins like Salesforce.com, Workday [and] Red Hat have all pulled back from their highs,"" the ""Mad Money"" host said. ""The problem with the cloud is very simple: a lot of investors don't understand it because it's fundamentally about the enterprise, companies, not about the consumer, you.""
Cramer argued that because most people do not interact with the work these companies do on a daily basis, they tend to mistrust their success. In reality, these giants help even bigger names like Amazon and Netflix save fortunes on hardware, cut overhead and streamline operations.
 But rather than explaining these cloud players' fundamentals, Cramer turned to the charts of technician Bob Lang, the founder of ExplosiveOptions.net and Cramer's colleague at TheStreet.com who helps run its Trifecta Stocks newsletter.
""While Salesforce, Workday and Red Hat have all had a very strong year, in the last five-odd weeks they've been hit with a wave of selling,"" Cramer said. ""However, they're now beginning to bounce back, and Lang believes that all three could be ready to resume their runs higher after some modest pullbacks.""
The ""Mad Money"" host started with the daily chart of one of his long-time favorites, Salesforce.
 After a healthy run earlier this year, shares of Salesforce took a hit in June, falling 8 percent before finding a floor of support at the stock's 50-day moving average, a technical indicator that smooths out a stock's random price fluctuations over a given time.
Salesforce's stock is still up nearly 30 percent year to date despite the pullback, and Lang noticed that the moving average convergence/divergence, or MACD, indicator, which helps technicians predict when a stock could change direction, made a bullish crossover.
That crossover, shown above by the black line crossing over the red line, is one of the most reliable ""buy"" signals in all of technical analysis, Cramer said.
Since Salesforce has shown signs of recovery since its pullback, including a bottoming ""W"" pattern that suggests the stock could go higher from here, Lang felt strongly about its trajectory.
""If Salesforce.com can rally less than two bucks from here to $90, then the W will have been confirmed, and from that level, Lang believes it could be an easy run to the mid-$90s or even past $100,"" Cramer said. ""In short, Salesforce's chart has a lot going for it. It's Lang's favorite name in the group.""
Shares of Workday, a cloud-based software provider that helps companies become more efficient by automating back-office functions like billing and expense tracking, also pulled back considerably in June.
 While indicators show that buying has slowed for the stock, Lang's daily chart for Workday showed that the stock's June decline went hand-in-hand with a decline in trading volume.
Lower volume indicates there were not many sellers, and if big institutions cannot bring themselves to sell Workday's stock when it is weak, Cramer said it could be stronger than it seems.
""Now, Lang believes that Workday is getting ready to make a run for its old highs. If the stock can climb less than a buck, climbing back over $100, then Lang thinks it could be smooth sailing to $105 in the not-too-distant future,"" Cramer said.
Finally, Cramer turned to the daily chart of another one of his favorites, open-source software company Red Hat.
 After Red Hat reported a much better-than-expected quarter and sprung to all-time highs in June, the stock tapered slightly and sold off some of its gains, a typical post-earnings pattern for the cloud provider.
Like Workday, the pullback happened on low volume, and Lang noticed the MACD indicator approaching the same kind of bullish crossover it made in Salesforce's chart.
""Plus, the upward slope of the Relative Strength Index, the RSI, an important momentum indicator, is very steep, which Lang tells us means this can continue to perform much better than the rest of the market,"" Cramer said. ""Put it all together, and Lang says that Red Hat really just needs to rally less than three dollars from here, to $100, at which point he expects the stock to roar higher before temporarily running out of steam at the $110 area.""
All in all, as much of the market shirks the cloud stocks due to concerns about how they are really performing, Lang's indicators show that in reality, they may just be getting started.
""Here's the bottom line: the cloud companies have some of the best growth rates around, and their charts, as interpreted by Bob Lang, suggest that stocks like Salesforce, Workday and Red Hat could be ready to roar once again after a nice pullback just last month,"" Cramer said.
Watch the full segment here:
 show chapters
 Cramer's charts show 3 cloud stocks shooting for the stars   
 7:12  PM ET Tue, 11 July 2017 |  07:08 
 Questions for Cramer? Call Cramer: 1-800-743-CNBC
Want to take a deep dive into Cramer's world? Hit him up! Mad Money Twitter -  Jim Cramer Twitter - Facebook - Instagram - Vine
Questions, comments, suggestions for the ""Mad Money"" website? madcap@cnbc.com
 var mps=mps||{}; mps._queue=mps._queue||{}; mps._queue.mpsinit=mps._queue.mpsinit||[]; 
 mps._queue.mpsinit.push(function() { 
 mps.insertComponent('#taboola_article_you_may_like', 'taboola-article-you-may-like') 
 });Jim Cramer uses the charts of technician Bob Lang to explain why Salesforce, Workday and Red Hat have more room to run.Jim Cramer uses the charts of technician Bob Lang to explain why Salesforce, Workday and Red Hat have more room to run.Jim Cramer uses the charts of technician Bob Lang to explain why Salesforce, Workday and Red Hat have more room to run.Jim Cramer uses the charts of technician Bob Lang to explain why Salesforce, Workday and Red Hat have more room to run.Jim Cramer uses the charts of technician Bob Lang to explain why Salesforce, Workday and Red Hat have more room to run.Jim Cramer uses the charts of technician Bob Lang to explain why Salesforce, Workday and Red Hat have more room to run.Jim Cramer uses the charts of technician Bob Lang to explain why Salesforce, Workday and Red Hat have more room to run.Jim Cramer uses the charts of technician Bob Lang to explain why Salesforce, Workday and Red Hat have more room to run.",148,2017-07-11,CRM,0.0016963532481785555
7,2017-08-02,Salesforce's second-largest business just hired its fourth new leader in four years as growth slows  ,"Mark Neuling | CNBC 
Marc Benioff, CEO of Salesforce.
 Salesforce has made the fourth leadership change in four years to its second-largest business, Service Cloud, as it struggles to meet revenue goals. The company has also effectively shut down a similar product for smaller businesses, Desk.com, according to sources.
 Bill Patterson, a 14-year Microsoft veteran who was most recently on the Dynamics team, has joined Service Cloud as its senior vice president and product management leader. He reports to Mike Rosenbaum, Salesforce's executive vice president of customer relationship management applications. Last week Patterson updated his LinkedIn profile to acknowledge his new job. MSDynamicsWorld was first to report the move. 
Service Cloud, a piece of software that customer-service representatives can use to manage inquiries, has been one of Salesforce's main growth drivers in recent years, going from $1.3 billion in sales in 2014 to $2.3 billion in 2016. But despite its growth, Service Cloud has dealt with frequent leadership turnover and a failure to reach its revenue goals in the past several years.
 Patterson is the fourth product leader in the past four years, and the seventh since Service Cloud's launch in 2009. Most recently, the position was held by Adam Blitzer, an executive VP who had been running both the Sales Cloud and Service Cloud teams since December. Patterson's hiring was in part aimed at alleviating some of the pressure Blitzer had felt, as he was managing two products that accounted for 75 percent of Salesforce's total revenue, according to the person. Now Blitzer is solely focusing on Sales Cloud.
""It's a dynamic industry, and things happen,"" Rosenbaum, a 12-year Salesforce veteran, told CNBC. In appointing Patterson, the idea is to assemble a ""better team"" that can take Service Cloud business to the next level, Rosenbaum said.
Although Service Cloud still accounts for 30 percent of Salesforce's revenue, the business' growth has slowed, going from 37.6 percent in year-over-year revenue growth in 2015 to 27.6 percent in 2016, according to Salesforce's most recent annual report. And Service Cloud has failed to reach its revenue goals for the past two years, a source said. (Rosenbaum wouldn't comment on that but did emphasize that IDC says Salesforce leads the customer service and support software market, ahead of Oracle and SAP, among others.)
The Service Cloud group has struggled when it comes to selling to small and medium-sized businesses, two people said. To go after smaller businesses, Salesforce acquired Assistly for around $50 million in 2011 and re-launched it under the Desk.com brand in early 2012.
One of the Desk.com team's assignments, a second source said, was to siphon business away from then-private Zendesk, which has grown into a $3 billion public company. Salesforce even tried to buy Zendesk, but when the effort faltered, the company went after Assistly, the second source said.
Desk.com amounted to a second customer-service tool that cost less money than Service Cloud. Some executives opposed it because it pulled down sales numbers for the bigger Service Cloud business that Desk.com is part of, while some salespeople preferred not to sell it because it left them with less compensation for the deals they landed, the second source said.
Rosenbaum challenged that assertion, saying that salespeople don't decide which types of customer service products to sell -- different sales teams go after different types of companies, he said.
At one point Salesforce had around 200 people working on Desk.com, the source said. But the company hasn't sought attention for a Desk.com product update for 17 months, and it's effectively not actively developing it anymore, according to two people. Salesforce says Asana, Bonobos and Coinbase are among the companies that use Desk.com; Rosenbaum said the company is committed to supporting the customers who still use the tool. The company's experience running Desk.com has influenced the development of its Service Cloud Lightning tool, which is suited for companies of any size, Rosenbaum said.
Patterson is the latest Microsoft executive to jump ship to Salesforce, representing a new development in the on-and-off relationship between the two longtime rivals. Last year, Salesforce brought in Tony Prophet, a marketing exec, as its first chief equality officer. Previously, it brought in Bob Stutz, former Microsoft Dynamics' head of business, and Randy Kern, an executive from Microsoft's Azure cloud business.
 var mps=mps||{}; mps._queue=mps._queue||{}; mps._queue.mpsinit=mps._queue.mpsinit||[]; 
 mps._queue.mpsinit.push(function() { 
 mps.insertComponent('#taboola_article_you_may_like', 'taboola-article-you-may-like') 
 });",132,2017-08-02,CRM,0.014687470698246457
8,2017-08-17,"Business leaders not building in AI are making a major mistake: Pro  Human intellect and AI will combine, not replace each other: Pro  ","Steve Garnett, technology entrepreneur and former EMEA chairman at Salesforce, says that predictions of man and machine physically merging are way in the future.Steve Garnett, technology entrepreneur and former EMEA chairman at Salesforce, says that predictions of man and machine physically merging are way in the future.Steve Garnett, technology entrepreneur and former EMEA chairman at Salesforce, says that predictions of man and machine physically merging are way in the future.Steve Garnett, technology entrepreneur and former EMEA chairman at Salesforce, says that predictions of man and machine physically merging are way in the future.Steve Garnett, technology entrepreneur and former EMEA chairman at Salesforce, weighs in on the rise of AI.Steve Garnett, technology entrepreneur and former EMEA chairman at Salesforce, weighs in on the rise of AI.Steve Garnett, technology entrepreneur and former EMEA chairman at Salesforce, weighs in on the rise of AI.Steve Garnett, technology entrepreneur and former EMEA chairman at Salesforce, weighs in on the rise of AI.",121,2017-08-17,CRM,0.014853920987962262
