,postDate,headline,articleHTML,Unnamed: 0,date,ticker,daily_change
0,2017-04-06,Constellation Brands CEO 'extremely optimistic' about 2017 despite border tax worries  ,"Jim Cramer spoke with Robert Sands, who said his rapidly growing alcohol distributor sees good times ahead.Jim Cramer spoke with Robert Sands, who said his rapidly growing alcohol distributor sees good times ahead.Jim Cramer spoke with Robert Sands, who said his rapidly growing alcohol distributor sees good times ahead.Jim Cramer spoke with Robert Sands, who said his rapidly growing alcohol distributor sees good times ahead.",213,2017-04-06,STZ,-0.06227061681308557
1,2017-04-10,Cramer ranks the top US brewers and serves up a winner  Cramer ranks the top US brewers and serves up a winner  Cramer ranks the brewers  ,"show chapters
 Cramer ranks the brewers   
 8:07  PM ET Mon, 10 April 2017 |  02:31 
 In light of Constellation Brands' success in the beer space, Jim Cramer turned to its competitors to flesh out the players that could really pour some gains into your portfolio.
 First Cramer turned to Anheuser-Busch InBev, the Belgium-based parent of Budweiser and the largest brewer in the world, thanks to its September acquisition of SABMiller.
""With its vast scale, BUD can spread out its marketing costs and take advantage of all sorts of commercial opportunities that might not be available to smaller brewers,"" the ""Mad Money"" host said. ""Nobody even comes close to these guys.""
 But Anheuser-Busch's last earnings report was a slight miss, with revenues topping expectations but earnings taking a hit due to the SABMiller purchase. Total volumes also declined 3.3 percent despite positive rhetoric from management.
Watch the full segment here:
 show chapters
 Cramer ranks the top US brewers and serves up a winner   
 6:58  PM ET Mon, 10 April 2017 |  11:53 
 ""Put it all together and the numbers don't paint a very flattering picture,"" Cramer said. ""In short, while I'm an avid drinker of Bud Light ... BUD's stock really seems like nothing to write home about, except for that 3 percent yield.""
Next Cramer looked into The Boston Beer Company, known for its Sam Adams beer brand. The company has been embroiled in a battle of the craft beers as smaller, more hip brands chip away at its market share.
""The issue here is whether Boston Beer has finally bottomed,"" Cramer said. Boston Beer beat analyst expectations in its February earnings report, but management gave a very wide range for its 2017 earnings forecast, suggesting that they are not clear yet on whether the year will be good or bad.
Cramer added that the company is in the throes of looking for a new CEO, which means it could take a while for the company to get back on track.
Third came Molson Coors, parent of Miller Lite, Coors Lite, Blue Moon, and Keystone, as well as the second-largest brewer in the United States.
Molson Coors was a big benefactor of the Anheuser-Busch-SABMiller deal, snagging the rest of the MillerCoors venture for a mere $12 billion, but Cramer worries that weak performance in the domestic premium beer segment could mean a tipsy future for the company.
""At this point, the story's all about the fact that they bought the MillerCoors joint venture for a song. And while that could be a decent narrative, it's not exactly the kind of organic growth that money managers really salivate over,"" he said.
At the end of the day, Constellation Brands seems to be the consistent go-to for growth and libations alike.
""Constellation's brands are on fire, including terrific Mexican beers like Modelo and Corona, and [one] we had a hard time keeping in stock this weekend at Bar San Miguel: Pacifico,"" Cramer said.
The company has perpetually delivered double-digit revenue growth, strong cash flow and earnings beats, and has been scooping up market share nationwide by acquiring small craft beer makers and other brands in popular segments.
And while Constellation would be at risk if Congress passed a border-adjusted tax, as the company imports many of its beers from Mexico, Cramer thinks the tax passing is unlikely.
""Constellation Brands has become the undisputed king of the beer space, with incredible growth that its competitors would kill for. I would make a case for Molson Coors or BUD, but honestly, Constellation's best of breed. It's the one you should own, especially when the market gives you the periodic border tax dip,"" the ""Mad Money"" host said.
Questions for Cramer? Call Cramer: 1-800-743-CNBC
Want to take a deep dive into Cramer's world? Hit him up! Mad Money Twitter -  Jim Cramer Twitter - Facebook - Instagram - Vine
Questions, comments, suggestions for the ""Mad Money"" website? madcap@cnbc.com
 var mps=mps||{}; mps._queue=mps._queue||{}; mps._queue.mpsinit=mps._queue.mpsinit||[]; 
 mps._queue.mpsinit.push(function() { 
 mps.insertComponent('#taboola_article_you_may_like', 'taboola-article-you-may-like') 
 });Jim Cramer says that when it comes to the beer space, Constellation Brands is the life of the party.Jim Cramer says that when it comes to the beer space, Constellation Brands is the life of the party.Jim Cramer says that when it comes to the beer space, Constellation Brands is the life of the party.Jim Cramer says that when it comes to the beer space, Constellation Brands is the life of the party.Jim Cramer says that when it comes to the beer space, Constellation Brands is the life of the party.Jim Cramer says that when it comes to the beer space, Constellation Brands is the life of the party.Jim Cramer says that when it comes to the beer space, Constellation Brands is the life of the party.Jim Cramer says that when it comes to the beer space, Constellation Brands is the life of the party.",211,2017-04-10,STZ,-0.005268716086826721
2,2017-04-17,Goldman makes this beer importer one of its favorite stocks ,"Susana Gonzalez | Bloomberg | Getty Images
A worker from Constellations Brands Inc.'s Grupo Modelo subsidiary makes a delivery in the Zona Rosa neighborhood of Mexico City.
 Investors should buy Constellation Brands shares because the company's earnings next year will come in above current expectations, according to Goldman Sachs, which reiterated its buy rating and added the firm to its Americas conviction list. ""Concerns around the recent slowdown in beer sales seems overdone, in our view. We see a sizable runway for high-single-digit beer sales growth to be sustained,"" analyst Judy Hong wrote in a note to clients Monday. ""Within our coverage, we now see STZ as possessing the best combination of growth and valuation."" Constellation Brands is a leading beer, wine and spirits company. The firm has the exclusive right to import popular beer brands such as Corona Extra, Modelo Especial and Pacifico into the U.S.
 var mps=mps||{}; mps._queue=mps._queue||{}; mps._queue.mpsinit=mps._queue.mpsinit||[]; 
 mps._queue.mpsinit.push(function() { 
 mps.insertComponent('#taboola_article_you_may_like', 'taboola-article-you-may-like') 
 });",207,2017-04-17,STZ,-0.006901257225133969
3,2017-05-05,Constellation Brands CFO: We did a lot of work on effect of a BAT on our business  ,"David Klein, Constellation Brands CFO and member of CNBC's Global CFO Council, discusses Mexican beer and how it may be affected by Trump administration policies, as well as the beverage company's outlook for their portfolio of brands.David Klein, Constellation Brands CFO and member of CNBC's Global CFO Council, discusses Mexican beer and how it may be affected by Trump administration policies, as well as the beverage company's outlook for their portfolio of brands.David Klein, Constellation Brands CFO and member of CNBC's Global CFO Council, discusses Mexican beer and how it may be affected by Trump administration policies, as well as the beverage company's outlook for their portfolio of brands.David Klein, Constellation Brands CFO and member of CNBC's Global CFO Council, discusses Mexican beer and how it may be affected by Trump administration policies, as well as the beverage company's outlook for their portfolio of brands.",193,2017-05-05,STZ,-0.007365583888480281
4,2017-05-23,Constellation Brands made takeover approach for Jack Daniel's owner Brown-Forman  Breaking News from CNBC’s Leslie Picker: Constellation Brands Looks at Brown-Forman – Sources  Constellation Brands looking into Brown Forman  Brown-Forman not interested in selling to Constellation: Sources  Brown-Forman not interested in selling: Sources  Spirits companies Constellation Brands and Brown-Forman sink on deal chatter  ,"show chapters
 Brown-Forman not interested in selling to Constellation: Sources   
 3:27  PM ET Tue, 23 May 2017 |  02:30 
 Constellation Brands, the owner of Corona and Svedka Vodka, has made an approach to acquire Jack Daniel's owner Brown-Forman, people with knowledge of the matter said.
 Brown-Forman said it was not interested in selling, but informed the board of Constellation Brands' interest, said the people, who asked not to be named discussing private information.
Terms of any potential offer could not be learned, but Brown-Forman's market cap is hovering around $22 billion. There are no ongoing talks, one of the people said. But Constellation remains interested in a potential merger. 
 The Brown family, who are fifth-generation owners of Brown-Forman, own a majority of the voting power and have indicated historically that they do not want to sell their company.
Shares of Brown-Forman have gained 12 percent over the last week, amid takeover rumors.
The stock rose 4.9 percent on the report of the deal Tuesday, before being halted briefly. When trading resumed, Brown shares gave back those gains and turned sharply lower. They were recently down nearly 6 percent. 
A representative for Brown-Forman declined to comment. A representative for Constellation Brands did not immediately respond to a request seeking comment.
 var mps=mps||{}; mps._queue=mps._queue||{}; mps._queue.mpsinit=mps._queue.mpsinit||[]; 
 mps._queue.mpsinit.push(function() { 
 mps.insertComponent('#taboola_article_you_may_like', 'taboola-article-you-may-like') 
 });WHEN: Today, Tuesday, May 23rd
WHERE: CNBC's ""Power Lunch""
Following is the unofficial transcript of breaking news from CNBC's Leslie Picker on ""Power Lunch"" (M-F, 1PM-3PM ET) today, Tuesday, May 23rd. Following is a link to Leslie's story on CNBC.com: http://www.cnbc.com/2017/05/23/constellation-brands-made-offer-to-buy-brown-forman.html.
 All references must be sourced to CNBC.
LESLIE PICKER: WE'RE HEARING THAT CONSTELLATION BRANDS HAS MADE AN APPROACH TO ACQUIRE JACK DANIELS OWNER BROWN-FORMAN. THIS IS ACCORDING TO SEVERAL PEOPLE WITH KNOWLEDGE OF THE MATTER. WHILE CONSTELLATION BRANDS SAID IT WAS INTERESTED IN PURCHASING BROWN-FORMAN, BROWN-FORMAN SAID IT WAS NOT INTERESTED IN SELLING, BUT PASSED THE IDEA ALONG TO THE BOARD THE PEOPLE SAID. CONSTELLATION BRANDS, HOWEVER, IS STILL INTERESTED ONE OF THE PEOPLE SAID. THE BROWN FAMILY, WHO ARE FIFTH GENERATION OWNERS OF BROWN-FORMAN, OWN A MAJORITY OF THE VOTING POWER AND HISTORICALLY SAID THEY WANT THE COMPANY TO REMAIN INDEPENDENT. NOW, SHARES OF BROWN-FORMAN HAVE GAINED 12% OVER THE LAST WEEK AS RUMORS ABOUT THE COMPANY BLED INTO THE MARKET. A REPRESENTATIVE FOR BROWN-FORMAN DECLINED TO COMMENT, A REPRESENTATIVE FOR CONSTELLATION BRANDS DID NOT IMMEDIATELY RESPOND TO A REQUEST SEEKING COMMENT. BROWN-FORMAN WITH A MARKET CAP OF AROUND $22 BILLION OWNS ALCOHOL BRANDS LIKE JACK DANIELS, WHILE CONSTELLATION BRANDS OWNS CORONA AND SVEDKA VODKA. BACK TO YOU.
MELISSA LEE: LESLIE, WE ARE ALSO SEEING CONSTELLATION BRANDS STOCK SPIKE WHICH IS REALLY TELLING IN TERMS OF WHAT INVESTORS THINK ABOUT THIS POTENTIAL COMBINATION. ANY IDEA ON WHETHER OR NOT, I MEAN, BASED ON THE BALANCE SHEET, CONSTELLATION WOULD USE STOCK OR CASH?
PICKER: IT'S UNCLEAR EXACTLY WHAT THEY ARE THINKING AT THIS TIME IN TERMS OF THE CURRENCY BY WHICH THEY WOULD PAY FOR THIS. BUT IT'S CERTAINLY SOMETHING THAT THEY ARE THINKING ABOUT. THEIR MARKET CAPS AREN'T TOO DISSIMILAR. SO I WOULD PRESUME THAT THEY WOULD HAVE TO USE SOME COMBINATION, BUT IT'S UNCLEAR EXACTLY WHAT THEY ARE THINKING AT THIS TIME.
About CNBC:
With CNBC in the U.S., CNBC in Asia Pacific, CNBC in Europe, Middle East and Africa, and CNBC World, CNBC is the recognized world leader in business news and provides real-time financial market coverage and business information to more than 385 million homes worldwide, including more than 94 million households in the United States and Canada. CNBC also provides daily business updates to 400 million households across China. The network's 15 live hours a day of business programming in North America (weekdays from 4:00 a.m. - 7:00 p.m. ET) is produced at CNBC's global headquarters in Englewood Cliffs, N.J., and includes reports from CNBC News bureaus worldwide. CNBC at night features a mix of new reality programming, CNBC's highly successful series produced exclusively for CNBC and a number of distinctive in-house documentaries.
CNBC also has a vast portfolio of digital products which deliver real-time financial market news and information across a variety of platforms including: CNBC.com; CNBC PRO, the premium, integrated desktop/mobile service that provides live access to CNBC programming, exclusive video content and global market data and analysis; a suite of CNBC mobile products including the CNBC Apps for iOS, Android and Windows devices; and additional products such as the CNBC App for the Apple Watch and Apple TV.
Members of the media can receive more information about CNBC and its programming on the NBCUniversal Media Village Web site at http://www.nbcumv.com/programming/cnbc.
For more information about NBCUniversal, please visit http://www.NBCUniversal.com.
 var mps=mps||{}; mps._queue=mps._queue||{}; mps._queue.mpsinit=mps._queue.mpsinit||[]; 
 mps._queue.mpsinit.push(function() { 
 mps.insertComponent('#taboola_article_you_may_like', 'taboola-article-you-may-like') 
 });CNBC's Leslie Picker reports that Constellation Brands has approached Brown Forman for a takeover.CNBC's Leslie Picker reports that Constellation Brands has approached Brown Forman for a takeover.CNBC's Leslie Picker reports that Constellation Brands has approached Brown Forman for a takeover.CNBC's Leslie Picker reports that Constellation Brands has approached Brown Forman for a takeover.CNBC's Leslie Picker reports the latest news that Constellation Brands has approached Brown-Forman for a takeover.CNBC's Leslie Picker reports the latest news that Constellation Brands has approached Brown-Forman for a takeover.CNBC's Leslie Picker reports the latest news that Constellation Brands has approached Brown-Forman for a takeover.CNBC's Leslie Picker reports the latest news that Constellation Brands has approached Brown-Forman for a takeover.CNBC's Leslie Picker reports on the lack of interest from Brown-Forman in making a deal with Constellation Brands.CNBC's Leslie Picker reports on the lack of interest from Brown-Forman in making a deal with Constellation Brands.CNBC's Leslie Picker reports on the lack of interest from Brown-Forman in making a deal with Constellation Brands.CNBC's Leslie Picker reports on the lack of interest from Brown-Forman in making a deal with Constellation Brands.CNBC's Leslie Picker reports on Brown-Forman turning down a deal with Constellation Brands, as both stocks sink before the closing bell. The “Fast Money” traders weigh in.CNBC's Leslie Picker reports on Brown-Forman turning down a deal with Constellation Brands, as both stocks sink before the closing bell. The “Fast Money” traders weigh in.CNBC's Leslie Picker reports on Brown-Forman turning down a deal with Constellation Brands, as both stocks sink before the closing bell. The “Fast Money” traders weigh in.CNBC's Leslie Picker reports on Brown-Forman turning down a deal with Constellation Brands, as both stocks sink before the closing bell. The “Fast Money” traders weigh in.",181,2017-05-23,STZ,0.01797308654736557
5,2017-06-09,"We Deliver: AMD, PYPL & more  ","""Fast Money"" Trader Guy Adami and Chad Morganlander, Washington Crossing Advisors, weigh in on whether ""Power Lunch"" viewers should buy, sell or hold Advanced Micro Devices, PayPal, Chesapeake Energy, Constellation Brands, Tesoro and Under Armour.""Fast Money"" Trader Guy Adami and Chad Morganlander, Washington Crossing Advisors, weigh in on whether ""Power Lunch"" viewers should buy, sell or hold Advanced Micro Devices, PayPal, Chesapeake Energy, Constellation Brands, Tesoro and Under Armour.""Fast Money"" Trader Guy Adami and Chad Morganlander, Washington Crossing Advisors, weigh in on whether ""Power Lunch"" viewers should buy, sell or hold Advanced Micro Devices, PayPal, Chesapeake Energy, Constellation Brands, Tesoro and Under Armour.""Fast Money"" Trader Guy Adami and Chad Morganlander, Washington Crossing Advisors, weigh in on whether ""Power Lunch"" viewers should buy, sell or hold Advanced Micro Devices, PayPal, Chesapeake Energy, Constellation Brands, Tesoro and Under Armour.",169,2017-06-09,STZ,0.013445119535465157
6,2017-06-16,Four stocks the traders would buy for their dad  ,"The “Fast Money” traders discuss their final trades for the day including Ferrari, BlackBerry, Brown-Foreman and Constellation Brands.The “Fast Money” traders discuss their final trades for the day including Ferrari, BlackBerry, Brown-Foreman and Constellation Brands.The “Fast Money” traders discuss their final trades for the day including Ferrari, BlackBerry, Brown-Foreman and Constellation Brands.The “Fast Money” traders discuss their final trades for the day including Ferrari, BlackBerry, Brown-Foreman and Constellation Brands.",164,2017-06-16,STZ,-0.0032116977604427607
7,2017-06-21,Beer outperforms in the summer  ,"According to Kensho, beer stocks Constellation Brands, Molson Coors and Boston Beer outperform  in the summer months.According to Kensho, beer stocks Constellation Brands, Molson Coors and Boston Beer outperform  in the summer months.According to Kensho, beer stocks Constellation Brands, Molson Coors and Boston Beer outperform  in the summer months.According to Kensho, beer stocks Constellation Brands, Molson Coors and Boston Beer outperform  in the summer months.",161,2017-06-21,STZ,0.00027096599542582404
8,2017-07-11,Constellation Brands CEO says there's 'huge' untapped upside for his alcohol giant's top products  Constellation Brands CEO on untapped upside for top products  Constellation Brands CEO says there's 'huge' untapped upside for his alcohol giant's top products  ,"show chapters
 Constellation Brands CEO on untapped upside for top products   
 7:01  PM ET Tue, 11 July 2017 |  01:40 
 It may not seem like Constellation Brands, the owner of Corona beer and Svedka vodka, could do much to meaningfully improve its already robust business, but CEO Rob Sands says there is even more to be done.
 Between sips of the company's top-of-the-line wines and liquors, Sands and ""Mad Money"" host Jim Cramer discussed one tactic that could still boost Constellation's business: getting retailers to prioritize its products.
""We call that category management, where we go in and we give advice, objective advice, to retailers about how they should, for instance, set their shelves,"" Sands told Cramer on Tuesday. ""And obviously, they should be allocating more shelf space to the higher-margin, faster-moving premium items. So, again, our portfolio — Corona, Modelo Especial, Pacifico — these are very high-margin beers, very fast-moving items, and they actually are under-allocated shelf space.""
 Constellation Brands' stock is up over 26 percent year to date thanks in part to its iconic beer brands and its growing liquor category.
Watch the full segment here:
 show chapters
 Constellation Brands CEO says there's 'huge' untapped upside for his alcohol giant's top products   
 6:51  PM ET Tue, 11 July 2017 |  11:06 
 ""We've had dramatic success with Corona, Modelo Especial has now become the No. 2 import in the United States, and Pacifico is coming up right behind it. It's going to be a fantastic, fantastic growth driver,"" Sands said. ""The demographics are in our favor, so it's all great.""
But the next step is getting retailers to recognize that, the CEO said. While giant alcohol producers like Constellation do sell some of their higher-end products directly to consumers, retailers like liquor stores and alcohol distributors conduct most of the sales.
""It is the next leg, which really goes to the fact that there's huge upside, even in this portfolio, because as we are able to expand shelf space, we get more pack sizes in there,"" Sands told Cramer. ""As retailers start realizing that they're over-allocated to low-margin, low-growth brands and they need to allocate more space to higher-margin, their go-to is going to be the Constellation portfolio. Period.""
The shelving shuffle would give even more exposure to Constellation's red-hot Corona and Modelo Especial brands, a clear boon to the company's already stellar bottom line.
When it comes to consumer loyalty, however, Sands could not quite define what makes customers favor his company's beers above others.
""How does a beer get hot? First of all, if anybody had the answer to that, we probably wouldn't be sitting here even having this chat,"" he told Cramer. ""But it's really about consumers voting with their feet, OK? It's the consumer who makes any product, really in any industry, but in particular beer. It's what makes a beer hot. It's consumers. They like the product, it's an image thing, it makes them feel good when they drink it, it fits their image of themselves when they hold it in their hand. It's a whole variety of things that are really hard to capture.""
Beer aside, Constellation Brands is expanding its liquor and wine portfolio as well, adding bourbon brand High West, high-end tequila Casa Noble and Ruffino wine to its mix.
Enjoying a taste of Casa Noble's $1,500-a-bottle Alta Belleza tequila, Sands mused on Constellation's rival, Diageo, purchasing George Clooney's Casamigos tequila brand for $1 billion.
""I thought it was a big price,"" he told Cramer. ""And Casamigos is a hot brand and, you know, it's got Clooney and Rande Gerber and Mike Meldman behind it, so they're good guys. Hey, we wish them all the luck in the world. There's enough room for everybody in this particular category.""
But the message was clear: when it comes to the rest of the categories in alcohol, keep a close eye on Constellation Brands.
Questions for Cramer? Call Cramer: 1-800-743-CNBC
Want to take a deep dive into Cramer's world? Hit him up! Mad Money Twitter -  Jim Cramer Twitter - Facebook - Instagram - Vine
Questions, comments, suggestions for the ""Mad Money"" website? madcap@cnbc.com
 var mps=mps||{}; mps._queue=mps._queue||{}; mps._queue.mpsinit=mps._queue.mpsinit||[]; 
 mps._queue.mpsinit.push(function() { 
 mps.insertComponent('#taboola_article_you_may_like', 'taboola-article-you-may-like') 
 });Jim Cramer sits down with Constellation Brands CEO Rob Sands, who spills on the next leg of his company's journey upward.Jim Cramer sits down with Constellation Brands CEO Rob Sands, who spills on the next leg of his company's journey upward.Jim Cramer sits down with Constellation Brands CEO Rob Sands, who spills on the next leg of his company's journey upward.Jim Cramer sits down with Constellation Brands CEO Rob Sands, who spills on the next leg of his company's journey upward.Jim Cramer sits down with Constellation Brands CEO Rob Sands, who spills on the next leg of his company's journey upward.Jim Cramer sits down with Constellation Brands CEO Rob Sands, who spills on the next leg of his company's journey upward.Jim Cramer sits down with Constellation Brands CEO Rob Sands, who spills on the next leg of his company's journey upward.Jim Cramer sits down with Constellation Brands CEO Rob Sands, who spills on the next leg of his company's journey upward.",148,2017-07-11,STZ,-0.00036109463650978434
